Title,Link,Company,Location,Description,Level
"Technical Program Manager, Data Governance and Regulatory Programs",https://www.google.com/about/careers/applications/jobs/results/134696916448355014-technical-program-manager-data-governance-and-regulatory-programs?page=2,Google,"Warsaw, Poland","Note: By applying to this position you will have an opportunity to share your preferred working location from the following: Mountain View, CA, USA; New York, NY, USA; Seattle, WA, USA; San Francisco, CA, USA.Note: By applying to this position you will have an opportunity to share your preferred working location from the following: Mountain View, CA, USA; New York, NY, USA; Seattle, WA, USA; San Francisco, CA, USA.Minimum qualifications: Bachelor's degree in a technical field, or equivalent practical experience.  8 years of experience in program management. Experience leading two cycles of different regulatory programs tied to data handling in a product setting. Experience in leading processes multiple stakeholder groups, in a product setting with enterprise and consumer customer groups. Preferred qualifications: 8 years of experience managing cross-functional or cross-team projects. Experience in implementing external controls frameworks. Experience with ETL scripts, Google-specific resources and tooling like dashboard, workflows, GoogleSQL. Experience with projects involving multiple Directors/Vice President-level stakeholders and leading scaled communications. Knowledge of Machine Learning.",Advanced
"Software Developer II, Site Reliability Developer, Google Cloud",https://www.google.com/about/careers/applications/jobs/results/103424140139995846-software-developer-ii-site-reliability-developer-google-cloud?page=2,Google,"Mountain View, CA, USA","Note: By applying to this position you will have an opportunity to share your preferred working location from the following: Waterloo, ON, Canada; Sunnyvale, CA, USA; San Francisco, CA, USA.Note: By applying to this position you will have an opportunity to share your preferred working location from the following: Waterloo, ON, Canada; Sunnyvale, CA, USA; San Francisco, CA, USA.Minimum qualifications: Bachelor’s degree in Computer Science, a related field, or equivalent practical experience. Experience with data structures/algorithms and software development in one or more programming languages.  Preferred qualifications: Master's degree in Computer Science or Engineering.",Early
"Technical Program Manager, Platform Safety",https://www.google.com/about/careers/applications/jobs/results/76486490783130310-technical-program-manager-platform-safety?page=2,Google," New York, NY, USA","Minimum qualifications: Bachelor's degree in computer science or equivalent practical experience. 2 years of experience managing cross-functional or cross-team projects. Experience in managing external partners and vendors. Preferred qualifications: Bachelor’s degree in computer science, a related engineering field, or equivalent practical experience. Experience managing programs and cross-functional teams. Experience collaborating across functions and organizations to find commonality in technical roadmaps and team needs. Experience engaging with external security researchers and supporting the Vulnerability Rewards Program (VRP).",Mid
"Technical Writer, Cloud Security",https://www.google.com/about/careers/applications/jobs/results/108346868496245446-technical-writer-cloud-security?page=2,Google,"Mountain View, CA, USA","Note: By applying to this position you will have an opportunity to share your preferred working location from the following: Bengaluru, Karnataka, India; Pune, Maharashtra, India.Note: By applying to this position you will have an opportunity to share your preferred working location from the following: Bengaluru, Karnataka, India; Pune, Maharashtra, India.Minimum qualifications: Bachelor's degree in a relevant field, or equivalent practical experience. 4 years of experience creating content for technical audiences (e.g., developer documentation, Computer Science course material, or IT administration playbooks). Preferred qualifications: Experience in privacy and security engineering, especially encryption. Experience in writing for the web. Experience with HTML, CSS, and JavaScript. Ability to understand source code (e.g., Java and Python). Ability to work in a fluid  environment.",Mid
"Software Engineer III, Android,  Google Store",https://www.google.com/about/careers/applications/jobs/results/97648799085667014-software-engineer-iii-android-google-store?page=2,Google," New York, NY, USA","Minimum qualifications: Bachelor’s degree or equivalent practical experience.  2 years of experience with software development in one or more programming languages, or 1 year of experience with an advanced degree in an industry setting.  2 years of experience with data structures or algorithms in either an academic or industry setting, and with Android application development. Experience in Android, Kotlin, Java, Mobile App Development, API Design. Preferred qualifications: Master's degree or PhD in Computer Science or related technical field.  2 years of experience with performance, large-scale systems data analysis, visualization tools, or debugging. Experience developing accessible technologies.  Experience in code and system health, diagnosis and resolution, and software test engineering. Experience in backend e-commerce, internationalization, and localization.",Mid
"Senior Software Engineer, AI/ML GenAI, Google Cloud Applications AI",https://www.google.com/about/careers/applications/jobs/results/114458199423099590-senior-software-engineer-aiml-genai-google-cloud-applications-ai?page=2,Google,"Waterloo, ON, Canada","Note: By applying to this position you will have an opportunity to share your preferred working location from the following: Kirkland, WA, USA; Seattle, WA, USA.Note: By applying to this position you will have an opportunity to share your preferred working location from the following: Kirkland, WA, USA; Seattle, WA, USA.Minimum qualifications: Bachelor’s degree or equivalent practical experience. 5 years of experience with software development in one or more programming languages, and with data structures/algorithms. 3 years of experience testing, maintaining, or launching software products, and 1 year of experience with software design and architecture. 3 years of experience with state of the art GenAI techniques (e.g., LLMs, Multi-Modal, Large Vision Models) or with GenAI-related concepts (language modeling, computer vision). 3 years of experience with ML infrastructure (e.g., model deployment, model evaluation, optimization, data processing, debugging). Preferred qualifications: Master's degree or PhD in Computer Science or related technical field. 1 year of experience in a technical leadership role. Experience developing accessible technologies.",Mid
"ASIC Design For Testability Engineer, Silicon",https://www.google.com/about/careers/applications/jobs/results/107674548760912582-asic-design-for-testability-engineer-silicon?page=2,Google," Sunnyvale, CA, USA","Minimum qualifications: Bachelor's degree in Computer Science, Electronics or Electrical Engineering, or equivalent practical experience. 5 years of experience in ASIC design for test including complete silicon life cycle through DFT pattern bring-up on ATE and manufacturing. Experience with ATPG, Low Power designs, BIST, JTAG, IJTAG  tools and flow. Experience with DFT EDA tools (e.g., Tessent). Preferred qualifications: Experience with DFT for subsystems with multiple physical partitions. Experience with IJTAG ICL, PDL terminology, ICL extraction, ICL modeling with Siemens Tessent tool. Experience with Spyglass-DFT, and DFT Scan constraints, and evaluating STA paths. Experience in developing automated workflows using Python and Tcl. Experience in collaborating with Design, PD, and STA teams.",Mid
"Technical Solutions Engineer, AI/ML",https://www.google.com/about/careers/applications/jobs/results/81073385932497606-technical-solutions-engineer-aiml?page=2,Google,"Waterloo, ON, Canada","Please submit your resume in English - we can only consider applications submitted in this language. Only applications of candidates with Mexican citizenship will be evaluated for this role in compliance with the provisions of Article 7 of the Federal Labor Law. Please submit your resume in English - we can only consider applications submitted in this language.Only applications of candidates with Mexican citizenship will be evaluated for this role in compliance with the provisions of Article 7 of the Federal Labor Law.Minimum qualifications: Bachelor’s degree in Science, Technology, Engineering, Mathematics, or equivalent practical experience. 4 years of experience troubleshooting and advocating for customers' needs, and triaging technical issues (e.g., hardware, software, application, operational, process). 3 years of experience reading code in a general purpose coding language (e.g., Java, C, C++, Python, Shell, Go or JavaScript, etc.) or in system design. Ability to communicate in English fluently as this position requires client interactions. Preferred qualifications: 3 years of experience in technical consulting on supporting large enterprise customers with high service-level objective and service-level agreement requirements. Experience developing or training models using machine learning technologies (i.e., Tensorflow, Keras, PyTorch, etc.). Experience working with recommendation engines, data pipelines, or distributed machine learning. Experience with cloud computing (i.e., certifications, internships, coursework, etc.).",Mid
Associate Finance Analyst,https://www.google.com/about/careers/applications/jobs/results/107244429579821766-associate-finance-analyst?page=2,Google," Sunnyvale, CA, USA","Minimum qualifications:Bachelor's degree in Finance, Business Administration, Accounting, Mathematics, Economics, or equivalent practical experience. Experience with financial analysis, forecasting, or modeling.Preferred qualifications: Experience in data warehousing or reporting (e.g., SQL, SAP). Ability to form and leverage excellent relationships across functional areas and take initiative. Ability to communicate with executive business partners. Excellent problem-solving and modeling skills, combined with business judgment and strategic thinking. Excellent presentation and verbal/written communication skills.",Early
gTechs Ads Global Solutions and Platforms Engineer,https://www.google.com/about/careers/applications/jobs/results/133883038936244934-gtechs-ads-global-solutions-and-platforms-engineer?page=2,Google,"Bengaluru, Karnataka, India","Note: By applying to this position you will have an opportunity to share your preferred working location from the following: Hyderabad, Telangana, India; Bengaluru, Karnataka, India; Gurugram, Haryana, India.Note: By applying to this position you will have an opportunity to share your preferred working location from the following: Hyderabad, Telangana, India; Bengaluru, Karnataka, India; Gurugram, Haryana, India.Minimum qualifications:   Bachelor's degree in Computer Science or related technical field, or equivalent practical experience.  6 years of experience in full-stack software development and system design. 5 years of experience with web technologies such as HTML, CSS, JavaScript, and HTTP. Preferred qualifications: Experience in building platforms. Experience working with database technologies (e.g. SQL, NoSQL). Ability to handle multiple stakeholders and streams of work. Excellent coding skills in Java, Typescript, Angular, C++ etc. Excellent communication and project management skills.",Mid
"Storage Qualification Hardware Engineer, Google Cloud",https://www.google.com/about/careers/applications/jobs/results/73821534929461958-storage-qualification-hardware-engineer-google-cloud?page=2,Google,"Bengaluru, Karnataka, India","Google welcomes people with disabilities. Google welcomes people with disabilities.Minimum qualifications: Bachelor’s degree in Electrical Engineering, Computer Engineering, Physics, a related field, or equivalent practical experience. 1 year of experience working in storage and server system technical environments, or with an advanced degree. Preferred qualifications: Master’s degree in Electrical Engineering, Computer Engineering, or a related field. Experience in collecting and organizing information for reproducing failures, explaining root causes and verify solutions. Knowledge of storage and server systems, including their physical, functional, mechanical and electrical aspects. Understanding of the Linux operating system, shell scripting, and Python. Ability to characterize storage product quality over a large scale and use data analysis skills to enable quick and precise failure analysis. Excellent communication skills, and the ability to follow through on assigned tasks.",Early
"Field Sales Manager, Commercial and Digital Natives (Arabic)",https://www.google.com/about/careers/applications/jobs/results/112419719142613702-field-sales-manager-commercial-and-digital-natives-arabic?page=2,Google,"Bengaluru, Karnataka, India","Minimum qualifications: Bachelor's degree or equivalent practical experience. 10 years of experience with quota-carrying cloud or software business, or account management at a Business-to-Business (B2B) software company. Experience in people management, team lead, mentorship, or coaching. Ability to communicate in Arabic fluently to support client relationship management in this region. Preferred qualifications: Experience in managing and leading a team. Experience in working with cross-functional internal teams (e.g., Business Development, Customer Engineers, Partner Business) and external partners in implementation projects and negotiations. Experience in working with the Commercial Sector or Digital Native organizations, with understanding their tests and aligning technology solutions to drive business outcomes. Ability to manage business and commercial models with leading organizational transformations and delivering on results.",Advanced
Data Center Maintenance Planner Program Manager,https://www.google.com/about/careers/applications/jobs/results/81005836297478854-data-center-maintenance-planner-program-manager?page=2,Google," Pune, Maharashtra, India","Minimum qualifications: Bachelor's degree in a technical field or equivalent practical experience. 1 year of program management experience. Experience in planning and scheduling of mission critical facility maintenance activities. Experience with third-party CMMS programs. Experience in developing long-term maintenance plans and forecasts. Preferred qualifications: Experience in managing and scheduling maintenance vendors. Experience in planning and scheduling of maintenance activities, mechanical, electrical, controls, with excellent communication skills. Ability to interact with internal customers and external parties, and resolve issues efficiently. Excellent collaboration and problem-solving skills with the ability to develop long term tactical maintenance plans and forecasts.",Early
Video Specialist,https://www.google.com/about/careers/applications/jobs/results/112457986714018502-video-specialist?page=2,Google,"Bengaluru, Karnataka, India","Note: By applying to this position you will have an opportunity to share your preferred working location from the following: Hyderabad, Telangana, India; Gurugram, Haryana, India.Note: By applying to this position you will have an opportunity to share your preferred working location from the following: Hyderabad, Telangana, India; Gurugram, Haryana, India.Minimum qualifications: Bachelor's degree or equivalent practical experience. 2 years of experience working with digital media or digital marketing/advertising solutions, implementing and measuring campaigns and providing client solutions. Preferred qualifications: 3 years of experience in Internet products and technologies. Experience in data analysis, ability to interpret datasets, identify trends, and translate findings into compelling narratives, with a strong aptitude for quickly understanding technical concepts and knowing when to apply them. Knowledge of apps platforms and products, the performance advertising market, or online ads landscape. Ability to collaborate cross-functionally with multiple teams and stakeholders while building relationships. Effective project management skills with the ability to oversee multiple, simultaneous solutions, supported by internal teams. Strong business communication, negotiation, and influencing skills.",Early
"Software Engineer, Pixel Mobile Wireless",https://www.google.com/about/careers/applications/jobs/results/82720825865577158-software-engineer-pixel-mobile-wireless?page=2,Google," Pune, Maharashtra, India","Google welcomes people with disabilities.Google welcomes people with disabilities.Minimum qualifications: Bachelor’s degree or equivalent practical experience. 1 year of experience with software development in one or more programming languages (e.g., C, C++). 1 year of experience with data structures or algorithms. Preferred qualifications: Master's degree or PhD in Computer Science or related technical field. Experience coding  for C/C++ and Python. Knowledge of embedded system development, real-time operating systems (RTOS), Board Support Package and microcontrollers. Excellent problem-solving skills and knowledge of debug embedded software/hardware issues. Excellent communication skills and ability, and enthusiasm to learn.",Early
Product Solutions Consultant,https://www.google.com/about/careers/applications/jobs/results/83218389236884166-product-solutions-consultant?page=2,Google,"Bengaluru, Karnataka, India","Note: By applying to this position you will have an opportunity to share your preferred working location from the following: Hyderabad, Telangana, India; Gurgaon, Haryana, India.Note: By applying to this position you will have an opportunity to share your preferred working location from the following: Hyderabad, Telangana, India; Gurgaon, Haryana, India.Minimum qualifications: Bachelor’s degree or equivalent practical experience. 5 years of experience in a project/program management, consulting, or client-facing role Ability to work non-standard working hours in line with customer requirements. Preferred qualifications: MBA or Advanced degree in a Management, Business, or a related field. Experience with Google Ads or other online advertising solutions and the media landscape. Experience in account/campaign management roles, technical troubleshooting or customer support. Experience in business analysis to conduct analytics, develop dashboards, and make recommendations. Experience developing strategic perspectives on customer-focused solutions. Excellent communication and stakeholder management skills.",Mid
"Software Engineer III, AI/ML, Google Cloud AI",https://www.google.com/about/careers/applications/jobs/results/91920752869024454-software-engineer-iii-aiml-google-cloud-ai?page=2,Google,"Bengaluru, Karnataka, India","Note: By applying to this position you will have an opportunity to share your preferred working location from the following: Seattle, WA, USA; Sunnyvale, CA, USA; Mountain View, CA, USA.Note: By applying to this position you will have an opportunity to share your preferred working location from the following: Seattle, WA, USA; Sunnyvale, CA, USA; Mountain View, CA, USA.Minimum qualifications: Bachelor’s degree or equivalent practical experience. 2 years of experience with software development in one or more programming languages, or 1 year of experience with an advanced degree. 2 years of experience with data structures or algorithms. 1 year of experience with one or more of the following: Speech/audio (e.g., technology duplicating and responding to the human voice), reinforcement learning (e.g., sequential decision making), ML infrastructure, or specialization in another ML field. 1 year of experience with ML infrastructure (e.g., model deployment, model evaluation, optimization, data processing, debugging). Preferred qualifications: Master's degree or PhD in Computer Science or related technical fields. Experience developing accessible technologies.",Mid
"Technical Program Manager, Process and Data Products",https://www.google.com/about/careers/applications/jobs/results/138783849487180486-technical-program-manager-process-and-data-products?page=2,Google,"Kirkland, WA, USA","Minimum qualifications: Bachelor's degree in Statistics, Supply Chain, or equivalent practical experience. 2 years of experience managing projects. Experience in Supply Chain analysis and Data Insights, Data Analytics, and Program Management. Preferred qualifications: Master’s degree or PhD in engineering, statistics, supply chain, or equivalent practical experience. 2 years of experience managing cross-functional or cross-team projects. Experience in Supply Chain and Data Analytics.",Mid
"Technical Program Manager III, Manufacturing Test Development, Google Cloud",https://www.google.com/about/careers/applications/jobs/results/109087447022740166-technical-program-manager-iii-manufacturing-test-development-google-cloud?page=2,Google," Seattle, WA, USA","Minimum qualifications:Bachelor's degree in a technical field, or equivalent practical experience. 5 years of experience in program management.Experience in test development (e.g., design validation, hardware/manufacture/product/performance/quality testing).Experience in New Product Introduction (NPI) and manufacturing. Preferred qualifications:5 years of experience managing cross-functional or cross-team projects.5 years of experience in New Product Introduction and manufacturing.Experience in implementing or leading complex, transformational projects resulting in improvement of test or manufacturing operations in the area of quality, cost, speed.Experience within a broad range of hardware and test technologies including high complex optical test and manufacturing.Experience working in hardware and software test development or automation.",Mid
"Technical Program Manager III, Manufacturing Test Development, Google Cloud",https://www.google.com/about/careers/applications/jobs/results/109087447022740166-technical-program-manager-iii-manufacturing-test-development-google-cloud?page=3,Google,"Sunnyvale, CA, USA","Minimum qualifications:Bachelor's degree in a technical field, or equivalent practical experience. 5 years of experience in program management.Experience in test development (e.g., design validation, hardware/manufacture/product/performance/quality testing).Experience in New Product Introduction (NPI) and manufacturing. Preferred qualifications:5 years of experience managing cross-functional or cross-team projects.5 years of experience in New Product Introduction and manufacturing.Experience in implementing or leading complex, transformational projects resulting in improvement of test or manufacturing operations in the area of quality, cost, speed.Experience within a broad range of hardware and test technologies including high complex optical test and manufacturing.Experience working in hardware and software test development or automation.",Mid
"Corporate Account Manager, Google Cloud",https://www.google.com/about/careers/applications/jobs/results/119911126996525766-corporate-account-manager-google-cloud?page=3,Google,"Sunnyvale, CA, USA","Google welcomes people with disabilities. Google welcomes people with disabilities.Minimum qualifications: Bachelor's degree or equivalent practical experience. 7 years of experience in sales in the technology industry with SaaS, PaaS or IaaS products and platforms. Experience engaging with accounts, selling a portfolio of products at C-level. Preferred qualifications: Experience with large, complex commercial and legal negotiations working with procurement, legal, and business teams.Experience promoting Google Cloud computing technologies to large and complex organizations across geographies.Ability to influence decisions at the executive level.Ability to collaborate effectively across organizational boundaries, build relationships, and import and export talent and ideas to achieve a broader organizational goal.Ability to present analyses and break down technical concepts into simple terms to present to technical, and non-technical audiences.Ability to communicate in French and English fluently in order to manage relationships with clients.",Mid
"Account Manager, LCS: France (English, French)",https://www.google.com/about/careers/applications/jobs/results/107099784476533446-account-manager-lcs-france-english-french?page=3,Google,"Paris, France","Minimum qualifications: Bachelor's degree or equivalent practical experience. 2 years of experience in advertising, consultative business, business development, online media environment, or marketing roles. 1 year of experience in customer relationship management and project management. Ability to communicate in English and French fluently to support client relationship management in this region. Preferred qualifications: Experience in assessing and achieving client success by business techniques, including effective questioning, objection handling and engaging promoting. Experience in leadership and high executive functioning within the digital marketing space. Knowledge of online marketing strategy and tactics with the knowledge in managing digital advertising campaigns with performance marketing. Ability to own a portfolio in an advertising or media business context. Ability to build narratives and storytelling as a client engagement strategy.",Early
