Title,Link,Company,Location,Description,Level
"Software Engineer III, Infrastructure, Core",https://www.google.com/about/careers/applications/jobs/results/110690555461018310-software-engineer-iii-infrastructure-core?page=1,Google,"Bengaluru, Karnataka, India","Minimum qualifications: Bachelor’s degree or equivalent practical experience. 2 years of experience with software development in one or more programming languages, or 1 year of experience with an advanced degree.  2 years of experience with data structures or algorithms in either an academic or industry setting. Preferred qualifications: Master's degree or PhD in Computer Science or related technical fields. 2 years of experience building and developing infrastructure, distributed systems or networks, or experience with compute technologies, storage, or hardware architecture.  Experience developing accessible technologies.",Mid
"Program Manager II, Compliance and Risk Management, Telecommunications",https://www.google.com/about/careers/applications/jobs/results/115248530313880262-program-manager-ii-compliance-and-risk-management-telecommunications?page=1,Google,"Bengaluru, Karnataka, India","Minimum qualifications: Bachelor's degree or equivalent practical experience. 2 years of experience in program or project management. Experience with compliance and auditing i.e. risk assessment, protocols, risk management. Experience within the telecommunications industry, i.e., carrier, data center provider, Outside Plant (OSP)/Internet Service Provider (ISP). Preferred qualifications: 2 years of experience managing cross-functional or cross-team projects. Experience developing and managing tools, policies, procedures, and processes for establishing compliance oversight, responding to incidents of non-compliance. Knowledge of subsea cables, cable stations, and Telecommunications (Telco) infrastructure investments. Knowledge of physical and cyber security measures for telecommunications and methods for auditing the implementation.",Mid
MicroLED Display Product Engineer,https://www.google.com/about/careers/applications/jobs/results/75226763403109062-microled-display-product-engineer?page=1,Google,"Reston, VA, USA","Minimum qualifications: Bachelor’s degree in Electrical Engineering, Computer Engineering, Computer Science, Physics, or a specialized field (e.g., Optics, Sensors, Audio/DSP, etc.), or equivalent practical experience. 4 years of experience working in a technical environment, or 3 years of experience with an advanced degree. Preferred qualifications: 8 years of experience in a product engineering or product development role, for semiconductors or display components. Experience with analyzing product data, specifications, yields, requirements, and trade-offs. Experience with designing and implementing scalable solutions for production ramp-up. Familiarity with microLED device fabrication and characterization, and display technologies and product applications.",Mid
"Staff Systems Development Engineering Manager, Google Public Sector",https://www.google.com/about/careers/applications/jobs/results/112344964918059718-staff-systems-development-engineering-manager-google-public-sector?page=1,Google,"Reston, VA, USA","Minimum qualifications: Bachelor's degree in Computer Science or IT-related field, or equivalent practical experience. 8 years of experience with systems automation, design and implementation. 8 years of experience with technical infrastructure (e.g., deployment, maintenance, troubleshooting), and with reliability of technical infrastructure. 5 years of experience with managing technical work, driving engineering strategy and roadmap. 5 years of experience managing or leading a team. Active TS/SCI Clearance with Polygraph. Preferred qualifications: 8 years of experience working with vendors or customers. Experience with continuous configuration automation tools (e.g., Ansible, Puppet, Chef, SaltStack, etc).  Experience with cloud technologies, Google Cloud Platform (GCP) or other cloud hyperscaler. Knowledge of the Open Systems Interconnect (OSI) model and network protocols. Ability to learn and stay ahead of emerging technologies. Ability to work both independently and collaboratively, with excellent communication and people management skills.",Advanced
"Program Manager, Strategic Business Operations",https://www.google.com/about/careers/applications/jobs/results/96851973449360070-program-manager-strategic-business-operations?page=1,Google,"Fremont, CA, USA","Note: By applying to this position you will have an opportunity to share your preferred working location from the following: Sunnyvale, CA, USA; New York, NY, USA; San Francisco, CA, USA.Note: By applying to this position you will have an opportunity to share your preferred working location from the following: Sunnyvale, CA, USA; New York, NY, USA; San Francisco, CA, USA.Minimum qualifications: Bachelor's degree in a technical field, or equivalent practical experience. 5 years of experience in program management. 5 years of experience developing analyses to support decision-making within international energy markets, renewable energy, climate, or sustainability industries. Preferred qualifications: Experience in internal operations, with the ability to identify opportunities and implement solutions that enhance efficiency and productivity (e.g., developing tools and resources to streamline processes and optimize workflows). Excellent communication and presentation skills, including experience collaborating with and presenting to senior leadership. Adept at conveying complex information in a clear and compelling manner. Ability to develop analyses to support strategic decision-making in the energy/power industry.",Mid
"Senior Software Engineer, AI/ML GenAI, Google Cloud AI",https://www.google.com/about/careers/applications/jobs/results/93855920110346950-senior-software-engineer-aiml-genai-google-cloud-ai?page=1,Google,"Fremont, CA, USA","Note: By applying to this position you will have an opportunity to share your preferred working location from the following: Sunnyvale, CA, USA; Kirkland, WA, USA.Note: By applying to this position you will have an opportunity to share your preferred working location from the following: Sunnyvale, CA, USA; Kirkland, WA, USA.Minimum qualifications: Bachelor’s degree or equivalent practical experience. 5 years of experience with software development in one or more programming languages, and with data structures/algorithms. 3 years of experience testing, maintaining, or launching software products, and 1 year of experience with software design and architecture. 3 years of experience with state of the art GenAI techniques (e.g., LLMs, Multi-Modal, Large Vision Models) or with GenAI-related concepts (language modeling, computer vision). 3 years of experience with ML infrastructure (e.g., model deployment, model evaluation, optimization, data processing, debugging). Preferred qualifications: Master's degree or PhD in Computer Science or related technical field. 1 year of experience in a technical leadership role. Experience developing accessible technologies.",Mid
"Technical Account Manager, Google Cloud Consulting (English, Japanese/Korean)",https://www.google.com/about/careers/applications/jobs/results/137506713581298374-technical-account-manager-google-cloud-consulting-english-japanesekorean?page=1,Google,"Reston, VA, USA","Google welcomes people with disabilities. Note: By applying to this position you will have an opportunity to share your preferred working location from the following: Kuala Lumpur, Federal Territory of Kuala Lumpur, Malaysia; Taipei, Taiwan.Google welcomes people with disabilities.Note: By applying to this position you will have an opportunity to share your preferred working location from the following: Kuala Lumpur, Federal Territory of Kuala Lumpur, Malaysia; Taipei, Taiwan.Minimum qualifications: Bachelor’s degree in Computer Science, Engineering, a related technical field, or equivalent practical experience. 5 years of experience in a customer-facing role working with stakeholders, driving customer technical implementations or transformation programs. Experience supporting customers in cloud operations (e.g., launch or capacity planning, product release management), technical support, escalation management, or IT consulting. Ability to communicate in English and Japanese or Korean fluently to engage with customers in Japan or Korea. Preferred qualifications: Experience in application or workload migration to public cloud providers. Experience translating business requirements into technological solutions. Experience collaborating across business units internally and at large enterprises. Experience collaborating with channel partners, systems integrators, and third-party developers to deliver high-impact solutions. Understanding of one of the following: IT operations, database systems, networking, IT security, application development, service architecture, cloud-native application development, hosted services, storage systems, or content delivery networks. Excellent communication, presentation, problem-solving, and management skills.",Mid
"Senior Software Engineer, Core Data, Data Indexing",https://www.google.com/about/careers/applications/jobs/results/80639225673720518-senior-software-engineer-core-data-data-indexing?page=1,Google,"Reston, VA, USA","Minimum qualifications:   Bachelor's degree in Computer Science or related technical field, or equivalent practical experience.  5 years of experience with one or more general purpose programming languages including but not limited to: Java, C/C++, Python, Objective C, JavaScript, or Go. 4 years of experience with Distributed Processing, System Design, High Performance Computing. Preferred qualifications:  Experience in solving ambiguous problems. Experience in building distributed systems. Ability to design and complete projects independently.",Mid
"Software Engineer III, Google Cloud",https://www.google.com/about/careers/applications/jobs/results/74939955737961158-software-engineer-iii-google-cloud?page=1,Google,"Sunnyvale, CA, USA","Note: By applying to this position you will have an opportunity to share your preferred working location from the following: Bengaluru, Karnataka, India; Hyderabad, Telangana, India; Pune, Maharashtra, India.Note: By applying to this position you will have an opportunity to share your preferred working location from the following: Bengaluru, Karnataka, India; Hyderabad, Telangana, India; Pune, Maharashtra, India.Minimum qualifications: Bachelor’s degree or equivalent practical experience. 2 years of experience with software development in one or more programming languages, or 1 year of experience with an advanced degree.  2 years of experience with data structures or algorithms.  Preferred qualifications: Master's degree or PhD in Computer Science or related technical fields. Experience developing accessible technologies.",Mid
"Administrative Business Partner, Google Cloud, Enterprise Sales (English)",https://www.google.com/about/careers/applications/jobs/results/100815685755511494-administrative-business-partner-google-cloud-enterprise-sales-english?page=1,Google," New York, NY, USA","Please submit your resume in English - we can only consider applications submitted in this language. Only applications of candidates with Mexican citizenship will be evaluated for this role in compliance with the provisions of Article 7 of the Federal Labor Law. Please submit your resume in English - we can only consider applications submitted in this language.Only applications of candidates with Mexican citizenship will be evaluated for this role in compliance with the provisions of Article 7 of the Federal Labor Law.Minimum qualifications: 2 years of administrative experience in a high-technical or international environment working on core administrative tasks (e.g., travel management, expense reports, calendar management, facilities coordination, etc.). Ability to communicate in English fluently as this is a role that requires communication with US and Canada based partners in English. Preferred qualifications: 3 years of administrative experience supporting executive-level management in a corporate environment, and managing small-scale projects and events from pre-planning to execution.",Early
"Lead Staff Software Engineer, Generative AI, Chrome",https://www.google.com/about/careers/applications/jobs/results/87868259344229062-lead-staff-software-engineer-generative-ai-chrome?page=1,Google,"Sunnyvale, CA, USA","Minimum qualifications: Bachelor's degree or equivalent practical experience. 8 years of experience in software development. 5 years of experience testing, and launching software products. 5 years of experience with machine learning algorithms and tools (e.g. TensorFlow), or applied ML (e.g., deep learning, natural language processing). 5 years of experience in Python programming. 3 years of experience with software design and architecture. Preferred qualifications: Master’s degree or PhD in Engineering, Computer Science, or a related technical field. 3 years of experience in a technical leadership role leading project teams and setting technical direction. 3 years of experience working in a complex, matrixed organization involving cross-functional, or cross-business projects. Experience working on Android mobile ecosystem.  Experience with Generative AI and Large Language Models (LLMs).",Advanced
"Strategic Partnerships Development Manager, Messaging Infrastructure",https://www.google.com/about/careers/applications/jobs/results/96117324343321286-strategic-partnerships-development-manager-messaging-infrastructure?page=1,Google," New York, NY, USA","Minimum qualifications: Bachelor's degree in Technology, Engineering, Science, Economics, or equivalent practical experience. 10 years of experience with developing partnerships in the global telecommunications domain. 8 years of experience in managing telecom carrier partners and vendor relationships in product development with problem solving and data reporting including financial analysis. Preferred qualifications: Experience in project management and with cross-functional collaboration. Knowledge of the telecommunication industry, interconnection standards, trends and developments. Knowledge of communications technologies, products and services like messaging, wireless networks and communications platforms. (e.g., SS7, SMPP, RCS, SMS hubbing, gateway, A2P, P2A, 2FA, IMS, number portability, SS7, VPN, cloud or virtual numbers, short code and long code services, network API’s) Ability to manage and prioritise multiple assignments, driving projects to completion with minimal guidance and attention to detail.",Advanced
"Software Engineer III, Scaled Infrastructure",https://www.google.com/about/careers/applications/jobs/results/119527140277265094-software-engineer-iii-scaled-infrastructure?page=1,Google,"Sunnyvale, CA, USA","Minimum qualifications: Bachelor's degree or equivalent practical experience. 2 years of experience with software development in one or more programming languages, or 1 year of experience with an advanced degree in an industry setting. 2 years of experience with data structures or algorithms in either an academic or industry setting, and building software for data privacy or security (e.g., identity and access management). Experience with C++, infrastructure design, and Android app development. Preferred qualifications: Master's degree or PhD in Computer Science or related technical fields. 2 years of experience with performance, large scale systems data analysis, visualization tools, or debugging. Experience developing accessible technologies. Experience with Security Analysis, Program Analysis, Decompiler. Knowledge of code and system health, diagnosis and resolution, and software test engineering.",Mid
"Technical Sales Specialist III, Platform, Canada, Google Cloud",https://www.google.com/about/careers/applications/jobs/results/102481202132198086-technical-sales-specialist-iii-platform-canada-google-cloud?page=1,Google," Kirkland, WA, USA","Minimum qualifications: Bachelor's degree or equivalent practical experience. 10 years of experience with cloud native architecture in a customer-facing or support role. Experience with cloud developing, on-premise developing, virtualization, or containerization platforms. Experience engaging with, and presenting to, technical stakeholders and executive leaders. Preferred qualifications: Experience in migrating applications and services to cloud platforms. Experience with security concepts such as encryption, identity management, access control, attack vectors, and pen testing. Experience prospecting, building, and maintaining customer relationships from scratch, with excitement for building out Greenfield territories.",Advanced
"Software Engineer, gReach Program for People with Disabilities (장애인 채용)",https://www.google.com/about/careers/applications/jobs/results/96440754758394566-software-engineer-greach-program-for-people-with-disabilities?page=1,Google,"Sunnyvale, CA, USA","This role is exclusively for people who have/or are in the process of applying for a government-issued disability certificate. 해당 직무는 정부에서 발급한 장애인 증명서를 소지하고 있거나 신청할 자격이 있는 사람들만 지원 가능합니다.This role is exclusively for people who have/or are in the process of applying for a government-issued disability certificate. 해당 직무는 정부에서 발급한 장애인 증명서를 소지하고 있거나 신청할 자격이 있는 사람들만 지원 가능합니다.Minimum qualifications: Bachelor’s degree or equivalent practical experience. 1 year of experience with software development in one or more programming languages (e.g., Python, C, C++, Java, JavaScript). 1 year of experience with data structures or algorithms. Ability to communicate in English and Korean fluently to collaborate with cross-functional teams in APAC and support client relationship management in Korea. Preferred qualifications: Experience with full stack development, across back-end such as Java, Python, GO, or C++ codebases, and front-end experience including JavaScript or TypeScript, HTML, CSS or equivalent. Experience in leading complex technical projects with automotive industry partners or related industry partners.",Early
"Key Account Manager, Devices and Services (Fixed-Term Contract) (English, Portuguese)",https://www.google.com/about/careers/applications/jobs/results/90405320685167302-key-account-manager-devices-and-services-fixedterm-contract-english-portuguese?page=1,Google," Kirkland, WA, USA","Minimum qualifications: Bachelor's degree or equivalent practical experience. 4 years of experience in technology sales or working with customers in a sales role. 2 years of experience leading in the retail or Telecom space with Consumer Electronics goods. Ability to communicate in English and Portuguese fluently to support client relationship management in this region. Preferred qualifications: 3 years of experience in sales management, business development or partner management in a consumer electronics/hardware company. Experience working towards  business goals. Ability to interpret legal documents and work with lawyers to complete agreements. Ability to plan and manage at executive and operational level within a retail sales environment.",Mid
"Senior Staff Software Engineer, Data Analytics, Google Cloud",https://www.google.com/about/careers/applications/jobs/results/105648575106425542-senior-staff-software-engineer-data-analytics-google-cloud?page=1,Google,"Kuala Lumpur, Federal Territory of Kuala Lumpur, Malaysia","Note: By applying to this position you will have an opportunity to share your preferred working location from the following: Kirkland, WA, USA; San Francisco, CA, USA; Sunnyvale, CA, USA.Note: By applying to this position you will have an opportunity to share your preferred working location from the following: Kirkland, WA, USA; San Francisco, CA, USA; Sunnyvale, CA, USA.Minimum qualifications: Bachelor's degree or equivalent practical experience.  5 years of experience with design and architecture; and testing/launching software products.  3 years of experience with data analytics and problem solving. Experience with distributed systems and data analytics. Preferred qualifications: Master’s degree or PhD in Engineering, Computer Science, or a related technical field. 8 years of experience in software development, and with data structures/algorithms. 5 years of experience in a technical leadership role leading project teams and setting technical direction. 3 years of experience working in a complex, matrixed organization involving cross-functional, or cross-business projects.",Advanced
"Logistics Operations Manager, Server Operations",https://www.google.com/about/careers/applications/jobs/results/141131440224903878-logistics-operations-manager-server-operations?page=1,Google," Taipei, Taiwan","Minimum qualifications: Bachelor's degree in Business, Logistics, Operations, Engineering, a related field, or equivalent practical experience. 5 years of experience managing third-party logistics providers/vendors. 5 years of experience in logistics and operations management. Preferred qualifications: Experience managing operations in multiple locations simultaneously. Ability to be successful in operations management, problem-solving, third-party logistics vendor relationships, budget creation, and cost management.",Mid
"Senior Software Engineer, Chrome OS Identity",https://www.google.com/about/careers/applications/jobs/results/112707905274159814-senior-software-engineer-chrome-os-identity?page=1,Google,"Kuala Lumpur, Federal Territory of Kuala Lumpur, Malaysia","Minimum qualifications: Bachelor’s degree or equivalent practical experience. 5 years of experience with software development in one or more programming languages, and with data structures/algorithms. 3 years of experience testing, maintaining, or launching software products, and 1 year of experience with software design and architecture. 3 years of experience working with embedded operating systems. Experience with Large Language Models, NLP, or Generative AI. Preferred qualifications: Experience in designing and implementing user interfaces (UIs).",Mid
"Technical Program Manager, Data Governance and Regulatory Programs",https://www.google.com/about/careers/applications/jobs/results/134696916448355014-technical-program-manager-data-governance-and-regulatory-programs?page=1,Google," Taipei, Taiwan","Note: By applying to this position you will have an opportunity to share your preferred working location from the following: Mountain View, CA, USA; New York, NY, USA; Seattle, WA, USA; San Francisco, CA, USA.Note: By applying to this position you will have an opportunity to share your preferred working location from the following: Mountain View, CA, USA; New York, NY, USA; Seattle, WA, USA; San Francisco, CA, USA.Minimum qualifications: Bachelor's degree in a technical field, or equivalent practical experience.  8 years of experience in program management. Experience leading two cycles of different regulatory programs tied to data handling in a product setting. Experience in leading processes multiple stakeholder groups, in a product setting with enterprise and consumer customer groups. Preferred qualifications: 8 years of experience managing cross-functional or cross-team projects. Experience in implementing external controls frameworks. Experience with ETL scripts, Google-specific resources and tooling like dashboard, workflows, GoogleSQL. Experience with projects involving multiple Directors/Vice President-level stakeholders and leading scaled communications. Knowledge of Machine Learning.",Advanced
"Product Manager II, Chrome Autofill",https://www.google.com/about/careers/applications/jobs/results/92102969859678918-product-manager-ii-chrome-autofill?page=2,Google,"Warsaw, Poland","Minimum qualifications: Bachelor's degree or equivalent practical experience. 5 years of experience in product management or related technical role. 2 years of experience taking technical products from conception to launch. Preferred qualifications: Experience with consumer-facing products. Experience in product delivery with the ability to break down an ambiguous problem space into tangible short-term steps. Knowledge in web development with the understanding of web capabilities and threat models. Knowledge in cross-functional areas including engineering, user experience and user research. Ability to articulate product vision in your area, documenting both short-term plans and long-term strategy. Excellent communication, problem-solving, organizational and investigative skills with the ability to meld quantitative data, qualitative insights, work on projects spanning multiple teams and own product instincts.",Mid
